idVia;nombreOriginal;idObject;idEje;idGrupo;tipoUso;nuDireccion;nuDobleS;nombreVia;nombreViaReduc;longitud;tipoVia;palabrasClave;municipio
-1;Hospital Doce de Octubre;325;322;310;PEATONAL;0;0; HOSPITAL DOCE DE OCTUBRE;HOSPITAL DOCE DE OCTUBRE;149,29668361600;;HOSPITAL DOCE OCTUBRE;Madrid
603000;Calle de Porta Coeli;326;323;311;CICLOCALLES;-1;0; CALLE DE PORTA COELI;PORTA COELI;270,73641565400;Calle;PORTA COELI;Madrid
246000;Calle de Dolores Barranco;327;324;313;CICLOCALLES;1;0; CALLE DE DOLORES BARRANCO;DOLORES BARRANCO;612,18653822700;Calle;DOLORES BARRANCO;Madrid
284700;Calle de los Evangelios;328;325;313;CICLOCALLES;1;0; CALLE DE LOS EVANGELIOS;EVANGELIOS;81,84469525310;Calle;EVANGELIOS;Madrid
468400;Manzanares;329;326;314;PEATONAL;0;0; MANZANARES;MANZANARES;96,52512533790;;MANZANARES;Madrid
468400;Manzanares;330;327;315;PEATONAL;0;0; MANZANARES;MANZANARES;81,42324294790;;MANZANARES;Madrid
468400;Manzanares;331;328;316;PEATONAL;0;0; MANZANARES;MANZANARES;93,61981791150;;MANZANARES;Madrid
468400;Manzanares;332;329;318;PEATONAL;0;0; MANZANARES;MANZANARES;232,93915846500;;MANZANARES;Madrid
453700;Calle del Maestro Arbos;333;330;319;PEATONAL;0;0; CALLE DEL MAESTRO ARBOS;MAESTRO ARBOS;35,82034908490;Calle;MAESTRO ARBOS;Madrid
2309;Calle del Pßrroco Eusebio Cuenca;334;331;320;CICLOCALLES;1;0; CALLE DEL PÁRROCO EUSEBIO CUENCA;PARROCO EUSEBIO CUENCA;624,28758117600;Calle;PÁRROCO EUSEBIO CUENCA;Madrid
119200;Calle de Bustamante;335;332;321;CICLOCALLES;1;0; CALLE DE BUSTAMANTE;BUSTAMANTE;252,33659281800;Calle;BUSTAMANTE;Madrid
31000401;Calle de Eros;336;333;322;CICLOCALLES;1;0; CALLE DE EROS;EROS;499,41251171800;Calle;EROS;Madrid
502400;Calle de Meneses;337;334;323;CICLOCALLES;-1;0; CALLE DE MENESES;MENESES;393,28214199200;Calle;MENESES;Madrid
31000027;Calle de Amaltea;338;335;324;CICLOCALLES;0;1; CALLE DE AMALTEA;AMALTEA;415,49660703900;Calle;AMALTEA;Madrid
484600;Calle del MarquÚs de Cubas;340;337;327;CICLOCALLES;-1;0; CALLE DEL MARQUÉS DE CUBAS;MARQUES DE CUBAS;206,43573553000;Calle;MARQUÉS CUBAS;Madrid
519000;Calle de la Montera;341;338;328;PEATONAL;0;0; CALLE DE LA MONTERA;MONTERA;348,08676255400;Calle;MONTERA;Madrid
19400;Calle de Alcßntara;342;339;329;CICLOCALLES;-1;0; CALLE DE ALCÁNTARA;ALCANTARA;752,49045014000;Calle;ALCÁNTARA;Madrid
292500;Calle de Fernßn Gonzßlez;344;340;329;CICLOCALLES;-1;0; CALLE DE FERNÁN GONZÁLEZ;FERNAN GONZALEZ;1080,24108513000;Calle;FERNÁN GONZÁLEZ;Madrid
91900;Calle de Bßrbara de Braganza;345;341;331;CICLOCALLES;1;0; CALLE DE BÁRBARA DE BRAGANZA;BARBARA DE BRAGANZA;51,01536202830;Calle;BÁRBARA BRAGANZA;Madrid
787800;Calle de Villanueva;348;344;331;CICLOCALLES;1;0; CALLE DE VILLANUEVA;VILLANUEVA;816,25544909200;Calle;VILLANUEVA;Madrid
560600;Calle de Palos de la Frontera;354;350;335;CICLOCALLES;1;0; CALLE DE PALOS DE LA FRONTERA;PALOS DE LA FRONTERA;347,84885855800;Calle;PALOS FRONTERA;Madrid
216100;Plaza de las Cortes;355;351;337;PEATONAL;0;0; PLAZA DE LAS CORTES;CORTES;43,72070142480;Plaza;CORTES;Madrid
295500;Calle de Fernanflor;356;352;338;CICLOCALLES;-1;0; CALLE DE FERNANFLOR;FERNANFLOR;100,62533143300;Calle;FERNANFLOR;Madrid
695600;Calle de Santa InÚs;357;353;339;CICLOCALLES;-1;0; CALLE DE SANTA INÚS;SANTA INES;108,58364269900;Calle;SANTA INÚS;Madrid
805800;Calle de Zorrilla;358;354;340;CICLOCALLES;1;0; CALLE DE ZORRILLA;ZORRILLA;242,43578043000;Calle;ZORRILLA;Madrid
697200;Paseo de Santa MarÝa de la Cabeza;359;355;341;PEATONAL;0;0; PASEO DE SANTA MARÍA DE LA CABEZA;SANTA MARIA DE LA CABEZA;68,67302882120;Paseo;SANTA MARÍA CABEZA;Madrid
366000;Calle del Hospital;360;356;344;CICLOCALLES;1;0; CALLE DEL HOSPITAL;HOSPITAL;190,11634235100;Calle;HOSPITAL;Madrid
168100;Calle de Cervantes;361;357;347;CICLOCALLES;1;0; CALLE DE CERVANTES;CERVANTES;354,14602233100;Calle;CERVANTES;Madrid
484600;Calle del MarquÚs de Cubas;362;358;348;CICLOCALLES;1;0; CALLE DEL MARQUÉS DE CUBAS;MARQUES DE CUBAS;111,46836030400;Calle;MARQUÉS CUBAS;Madrid
695900;Calle de Santa Isabel;364;360;350;CICLOCALLES;1;0; CALLE DE SANTA ISABEL;SANTA ISABEL;561,16116260800;Calle;SANTA ISABEL;Madrid
71000;Calle de Argumosa;365;361;351;CICLOCALLES;1;0; CALLE DE ARGUMOSA;ARGUMOSA;391,13717586500;Calle;ARGUMOSA;Madrid
241900;Calle del Doctor Fourquet;366;362;352;CICLOCALLES;1;0; CALLE DEL DOCTOR FOURQUET;DOCTOR FOURQUET;297,64368838800;Calle;DOCTOR FOURQUET;Madrid
311900;Calle de Fray Luis de Le¾n;367;363;353;CICLOCALLES;1;0; CALLE DE FRAY LUIS DE LEÓN;FRAY LUIS DE LEON;321,32825951300;Calle;FRAY LUIS LEÓN;Madrid
765600;Calle de Valencia;368;364;353;CICLOCALLES;1;0; CALLE DE VALENCIA;VALENCIA;225,79180781100;Calle;VALENCIA;Madrid
-1;;371;650;735;PEATONAL;0;0;;;216,54651893400;;;Madrid
782600;Calle de VÝctor de la Serna;374;653;745;CICLOCALLES;1;0; CALLE DE VÍCTOR DE LA SERNA;VICTOR DE LA SERNA;251,87980965500;Calle;VÍCTOR SERNA;Madrid
552700;Calle de Oruro;375;654;748;CICLOCALLES;1;0; CALLE DE ORURO;ORURO;195,65329237600;Calle;ORURO;Madrid
610450;Calle del PrÝncipe de Vergara;376;655;749;PEATONAL;0;0; CALLE DEL PRÍNCIPE DE VERGARA;PRINCIPE DE VERGARA;109,67394444400;Calle;PRÍNCIPE VERGARA;Madrid
44700;Calle de Anastasia L¾pez;377;656;753;CICLOCALLES;1;0; CALLE DE ANASTASIA LÓPEZ;ANASTASIA LOPEZ;167,75970480700;Calle;ANASTASIA LÓPEZ;Madrid
723600;Calle de Sinesio Delgado;378;657;754;CICLOCALLES;0;1; CALLE DE SINESIO DELGADO;SINESIO DELGADO;150,08678375700;Calle;SINESIO DELGADO;Madrid
78850;Calle del Arzobispo Morcillo;379;658;755;CICLOCALLES;0;1; CALLE DEL ARZOBISPO MORCILLO;ARZOBISPO MORCILLO;76,07520363650;Calle;ARZOBISPO MORCILLO;Madrid
496800;Calle de Mauricio Legendre;380;659;756;PEATONAL;0;0; CALLE DE MAURICIO LEGENDRE;MAURICIO LEGENDRE;634,36836912800;Calle;MAURICIO LEGENDRE;Madrid
381000;Calle de la Isla de Chipre;381;660;757;PEATONAL;0;0; CALLE DE LA ISLA DE CHIPRE;ISLA DE CHIPRE;59,43392985460;Calle;ISLA CHIPRE;Madrid
496800;Calle de Mauricio Legendre;382;661;758;PEATONAL;0;0; CALLE DE MAURICIO LEGENDRE;MAURICIO LEGENDRE;683,69159071100;Calle;MAURICIO LEGENDRE;Madrid
496800;Calle de Mauricio Legendre;383;662;759;CICLOCALLES;0;1; CALLE DE MAURICIO LEGENDRE;MAURICIO LEGENDRE;1264,07781293000;Calle;MAURICIO LEGENDRE;Madrid
427150;Calle de Labastida;384;663;760;CICLOCALLES;1;0; CALLE DE LABASTIDA;LABASTIDA;332,33525405500;Calle;LABASTIDA;Madrid
239000;Calle de la Divina Pastora;385;664;761;CICLOCALLES;0;1; CALLE DE LA DIVINA PASTORA;DIVINA PASTORA;118,82346734400;Calle;DIVINA PASTORA;Madrid
232750;Calle de Daniel Vßzquez DÝaz;386;665;762;CICLOCALLES;-1;0; CALLE DE DANIEL VÁZQUEZ DÍAZ;DANIEL VAZQUEZ DIAZ;195,03752674700;Calle;DANIEL VÁZQUEZ DÍAZ;Madrid
514425;Avenida de Monforte de Lemos;387;666;762;CICLOCALLES;-1;0; AVENIDA DE MONFORTE DE LEMOS;MONFORTE DE LEMOS;159,57694252300;Avenida;MONFORTE LEMOS;Madrid
467050;Calle de Manuel Tovar;388;667;763;CICLOCALLES;1;0; CALLE DE MANUEL TOVAR;MANUEL TOVAR;413,99514877600;Calle;MANUEL TOVAR;Madrid
386900;Calle de las Islas VÝrgenes;389;668;764;CICLOCALLES;-1;0; CALLE DE LAS ISLAS VÍRGENES;ISLAS VIRGENES;72,90368828910;Calle;ISLAS VÍRGENES;Madrid
309650;Calle de Francisco Sancha;390;669;766;CICLOCALLES;-1;0; CALLE DE FRANCISCO SANCHA;FRANCISCO SANCHA;26,17821144700;Calle;FRANCISCO SANCHA;Madrid
446000;Calle de Luis Esteban;391;670;768;CICLOCALLES;1;0; CALLE DE LUIS ESTEBAN;LUIS ESTEBAN;52,00129376760;Calle;LUIS ESTEBAN;Madrid
-1;Calle VÝa LÝmite;392;671;768;CICLOCALLES;1;0; CALLE VÍA LÍMITE;VIA LIMITE;788,84593277900;Calle;VÍA LÍMITE;Madrid
262600;Calle de Emilia;393;672;769;CICLOCALLES;-1;0; CALLE DE EMILIA;EMILIA;91,74002913770;Calle;EMILIA;Madrid
661400;Calle de San Benito;394;673;769;CICLOCALLES;-1;0; CALLE DE SAN BENITO;SAN BENITO;514,50894229500;Calle;SAN BENITO;Madrid
153600;Paseo de la Castellana;395;674;770;CICLOCALLES;0;1; PASEO DE LA CASTELLANA;CASTELLANA;182,95435124900;Paseo;CASTELLANA;Madrid
73800;Calle del Arroyo;396;675;771;CICLOCALLES;1;0; CALLE DEL ARROYO;ARROYO;248,43594103600;Calle;ARROYO;Madrid
660600;Calle de San Aquilino;398;677;773;CICLOCALLES;1;0; CALLE DE SAN AQUILINO;SAN AQUILINO;517,94793669200;Calle;SAN AQUILINO;Madrid
661400;Calle de San Benito;400;679;780;CICLOCALLES;-1;0; CALLE DE SAN BENITO;SAN BENITO;16,06841073300;Calle;SAN BENITO;Madrid
661400;Calle de San Benito;401;680;781;CICLOCALLES;1;0; CALLE DE SAN BENITO;SAN BENITO;18,18622148040;Calle;SAN BENITO;Madrid
455900;Calle de las Magnolias;403;682;785;CICLOCALLES;0;1; CALLE DE LAS MAGNOLIAS;MAGNOLIAS;136,85779862000;Calle;MAGNOLIAS;Madrid
153600;Paseo de la Castellana;404;683;786;PEATONAL;0;0; PASEO DE LA CASTELLANA;CASTELLANA;134,64692232000;Paseo;CASTELLANA;Madrid
78850;Calle del Arzobispo Morcillo;405;684;787;PEATONAL;0;0; CALLE DEL ARZOBISPO MORCILLO;ARZOBISPO MORCILLO;153,44262697900;Calle;ARZOBISPO MORCILLO;Madrid
580450;Calle de Pe±a Santa;406;685;788;CICLOCALLES;0;1; CALLE DE PEÑA SANTA;PEÐA SANTA;479,22518306300;Calle;PEÑA SANTA;Madrid
78850;Calle del Arzobispo Morcillo;407;686;789;PEATONAL;0;0; CALLE DEL ARZOBISPO MORCILLO;ARZOBISPO MORCILLO;182,10214732500;Calle;ARZOBISPO MORCILLO;Madrid
574451;Calle de Pedro Rico;408;687;790;CICLOCALLES;-1;0; CALLE DE PEDRO RICO;PEDRO RICO;353,18066428700;Calle;PEDRO RICO;Madrid
705600;Calle de Sebastißn Elcano;409;365;355;CICLOCALLES;1;0; CALLE DE SEBASTIÁN ELCANO;SEBASTIAN EL CANO;203,80596705100;Calle;SEBASTIÁN ELCANO;Madrid
705600;Calle de Sebastißn Elcano;410;366;357;PEATONAL;0;0; CALLE DE SEBASTIÁN ELCANO;SEBASTIAN EL CANO;80,48537039830;Calle;SEBASTIÁN ELCANO;Madrid
34600;Calle de Alonso del Barco;411;367;358;CICLOCALLES;1;0; CALLE DE ALONSO DEL BARCO;ALONSO EL BARCO;115,27369411300;Calle;ALONSO BARCO;Madrid
765800;Ronda de Valencia;412;368;359;PEATONAL;0;0; RONDA DE VALENCIA;VALENCIA;76,51522657480;Ronda;VALENCIA;Madrid
48800;Plaza del ?ngel;413;369;361;PEATONAL;0;0; PLAZA DEL ÁNGEL;ANGEL;171,22512417500;Plaza;ÁNGEL;Madrid
369000;Calle de la Huertas;414;370;361;PEATONAL;0;0; CALLE DE LA HUERTAS;HUERTAS;508,34304292000;Calle;HUERTAS;Madrid
435300;Calle del Le¾n;416;372;363;CICLOCALLES;1;0; CALLE DEL LEÓN;LEON;270,84594045100;Calle;LEÓN;Madrid
658500;Calle de San AgustÝn;417;373;364;CICLOCALLES;1;0; CALLE DE SAN AGUSTÍN;SAN AGUSTIN;196,37794349200;Calle;SAN AGUSTÍN;Madrid
754900;Costanilla de las Trinitarias;418;374;364;CICLOCALLES;1;0; COSTANILLA DE LAS TRINITARIAS;TRINITARIAS;54,43989945450;Costanilla;TRINITARIAS;Madrid
68300;Calle del Arenal;419;375;366;PEATONAL;0;0; CALLE DEL ARENAL;ARENAL;476,55863053000;Calle;ARENAL;Madrid
378200;Plaza de Isabel II;420;376;366;PEATONAL;0;0; PLAZA DE ISABEL II;ISABEL II;53,21256904230;Plaza;ISABEL II;Madrid
776900;Calle de Vergara;422;378;366;PEATONAL;0;0; CALLE DE VERGARA;VERGARA;51,19867662510;Calle;VERGARA;Madrid
614900;Plaza de la Puerta del Sol;423;379;367;PEATONAL;0;0; PLAZA DE LA PUERTA DEL SOL;PUERTA DEL SOL;20,37909886290;Plaza;PUERTA SOL;Madrid
614900;Plaza de la Puerta del Sol;424;380;369;PEATONAL;0;0; PLAZA DE LA PUERTA DEL SOL;PUERTA DEL SOL;21,62319050050;Plaza;PUERTA SOL;Madrid
614900;Plaza de la Puerta del Sol;425;381;370;PEATONAL;0;0; PLAZA DE LA PUERTA DEL SOL;PUERTA DEL SOL;28,32901589370;Plaza;PUERTA SOL;Madrid
235500;Costanilla de los Desamparados;426;382;372;CICLOCALLES;1;0; COSTANILLA DE LOS DESAMPARADOS;DESAMPARADOS;213,58062656700;Costanilla;DESAMPARADOS;Madrid
81600;Calle de Atocha;427;383;374;PEATONAL;0;0; CALLE DE ATOCHA;ATOCHA;30,25507817900;Calle;ATOCHA;Madrid
216100;Plaza de las Cortes;430;386;380;PEATONAL;0;0; PLAZA DE LAS CORTES;CORTES;82,57554279210;Plaza;CORTES;Madrid
695900;Calle de Santa Isabel;431;387;382;PEATONAL;0;0; CALLE DE SANTA ISABEL;SANTA ISABEL;431,87559380100;Calle;SANTA ISABEL;Madrid
695900;Calle de Santa Isabel;432;388;383;PEATONAL;0;0; CALLE DE SANTA ISABEL;SANTA ISABEL;15,23528819770;Calle;SANTA ISABEL;Madrid
290400;Calle de Felipe IV;433;389;385;CICLOCALLES;1;0; CALLE DE FELIPE IV;FELIPE IV;139,91082815100;Calle;FELIPE IV;Madrid
253400;Calle del Duque de Medinaceli;434;390;386;CICLOCALLES;-1;0; CALLE DEL DUQUE DE MEDINACELI;DUQUE DE MEDINACELI;135,07379200700;Calle;DUQUE MEDINACELI;Madrid
312800;Calle de Fucar;435;391;386;CICLOCALLES;-1;0; CALLE DE FUCAR;FUCAR;202,92193285300;Calle;FUCAR;Madrid
392400;Calle de Jes·s;436;392;386;CICLOCALLES;-1;0; CALLE DE JESÚS;JESUS;199,57224300200;Calle;JESÚS;Madrid
81600;Calle de Atocha;437;393;388;PEATONAL;0;0; CALLE DE ATOCHA;ATOCHA;72,02129150030;Calle;ATOCHA;Madrid
606800;Calle del Prado;438;394;390;CICLOCALLES;1;0; CALLE DEL PRADO;PRADO;23,10327758600;Calle;PRADO;Madrid
606900;Paseo del Prado;439;395;391;PEATONAL;0;0; PASEO DEL PRADO;PRADO;200,02201678100;Paseo;PRADO;Madrid
92900;Calle de Barcel¾;440;396;394;CICLOCALLES;1;0; CALLE DE BARCELÓ;BARCELO;243,58262031700;Calle;BARCELÓ;Madrid
373600;Calle de las Infantas;441;397;395;CICLOCALLES;1;0; CALLE DE LAS INFANTAS;INFANTAS;497,86728611100;Calle;INFANTAS;Madrid
325300;Calle de GarcÝa de Paredes;442;398;397;CICLOCALLES;-1;0; CALLE DE GARCÍA DE PAREDES;GARCIA DE PAREDES;861,67315592300;Calle;GARCÍA PAREDES;Madrid
172800;Calle del Clavel;443;399;403;CICLOCALLES;-1;0; CALLE DEL CLAVEL;CLAVEL;150,30783456900;Calle;CLAVEL;Madrid
770900;Plaza de Vßzquez de Mella;444;400;403;CICLOCALLES;1;0; PLAZA DE VÁZQUEZ DE MELLA;VAZQUEZ DE MELLA;113,89130010300;Plaza;VÁZQUEZ MELLA;Madrid
794800;Calle de la Virgen de los Peligros;445;401;403;CICLOCALLES;-1;0; CALLE DE LA VIRGEN DE LOS PELIGROS;VIRGEN DE LOS PELIGROS;160,19064757000;Calle;VIRGEN PELIGROS;Madrid
769700;Calle de Valverde;446;402;404;CICLOCALLES;1;0; CALLE DE VALVERDE;VALVERDE;250,44312439500;Calle;VALVERDE;Madrid
678800;Calle de San Mateo;447;403;405;CICLOCALLES;-1;0; CALLE DE SAN MATEO;SAN MATEO;302,08102531700;Calle;SAN MATEO;Madrid
612200;Calle de la Puebla;448;404;406;CICLOCALLES;1;0; CALLE DE LA PUEBLA;PUEBLA;196,53496652400;Calle;PUEBLA;Madrid
313100;Calle de Fuencarral;449;405;407;PEATONAL;0;0; CALLE DE FUENCARRAL;FUENCARRAL;424,34849079600;Calle;FUENCARRAL;Madrid
681300;Calle de San Onofre;450;406;408;CICLOCALLES;1;0; CALLE DE SAN ONOFRE;SAN ORFEON;69,80650837200;Calle;SAN ONOFRE;Madrid
212400;Calle de la Corredera Baja de San Pablo;451;407;411;CICLOCALLES;1;0; CALLE DE LA CORREDERA BAJA DE SAN PABLO;CORREDERA BAJA DE SAN PABLO;198,88759445900;Calle;CORREDERA BAJA SAN PABLO;Madrid
671900;Plaza de San Ildefonso;452;408;411;CICLOCALLES;1;0; PLAZA DE SAN ILDEFONSO;SAN ILDEFONSO;54,19378555920;Plaza;SAN ILDEFONSO;Madrid
176700;Calle de Col¾n;453;409;412;CICLOCALLES;1;0; CALLE DE COLÓN;COLON;59,80582223820;Calle;COLÓN;Madrid
671900;Plaza de San Ildefonso;454;410;416;PEATONAL;0;0; PLAZA DE SAN ILDEFONSO;SAN ILDEFONSO;23,61342628950;Plaza;SAN ILDEFONSO;Madrid
673200;Calle de San JoaquÝn;455;411;420;CICLOCALLES;-1;0; CALLE DE SAN JOAQUÍN;SAN JOAQUIN;119,25475775400;Calle;SAN JOAQUÍN;Madrid
33000;Calle del Almirante;456;412;421;CICLOCALLES;1;0; CALLE DEL ALMIRANTE;ALMIRANTE;341,84225098300;Calle;ALMIRANTE;Madrid
200710;Calle de Columela;457;413;421;CICLOCALLES;1;0; CALLE DE COLUMELA;COLUMELA;230,22176672700;Calle;COLUMELA;Madrid
344000;Calle de Gravina;458;414;421;CICLOCALLES;1;0; CALLE DE GRAVINA;GRAVINA;290,11253213000;Calle;GRAVINA;Madrid
633000;Calle de Recoletos;459;415;421;CICLOCALLES;1;0; CALLE DE RECOLETOS;RECOLETOS;292,96634711200;Calle;RECOLETOS;Madrid
308800;Calle de Francisco de Rojas;461;417;423;CICLOCALLES;1;0; CALLE DE FRANCISCO DE ROJAS;FRANCISCO DE ROJAS;77,88762432370;Calle;FRANCISCO ROJAS;Madrid
750700;Calle de Trafalgar;463;419;423;CICLOCALLES;1;0; CALLE DE TRAFALGAR;TRAFALGAR;117,22634619700;Calle;TRAFALGAR;Madrid
308800;Calle de Francisco de Rojas;464;420;424;CICLOCALLES;-1;0; CALLE DE FRANCISCO DE ROJAS;FRANCISCO DE ROJAS;83,95289387230;Calle;FRANCISCO ROJAS;Madrid
750700;Calle de Trafalgar;466;422;424;CICLOCALLES;-1;0; CALLE DE TRAFALGAR;TRAFALGAR;118,70137610100;Calle;TRAFALGAR;Madrid
92900;Calle de Barcel¾;467;423;425;CICLOCALLES;-1;0; CALLE DE BARCELÓ;BARCELO;206,66982093900;Calle;BARCELÓ;Madrid
18800;Calle de Alburquerque;468;424;427;CICLOCALLES;1;0; CALLE DE ALBURQUERQUE;ALBURQUERQUE;19,88022450390;Calle;ALBURQUERQUE;Madrid
328600;Calle del General Ampudia;1477;1469;1983;CICLOCALLES;-1;0; CALLE DEL GENERAL AMPUDIA;GENERAL AMPUDIA;344,32710640000;Calle;GENERAL AMPUDIA;Madrid
2537;Calle del Rector Royo-Villanova;1478;1470;1985;CICLOCALLES;0;1; CALLE DEL RECTOR ROYO-VILLANOVA;RECTOR ROYO-VILLANOVA;445,67350343100;Calle;RECTOR ROYO-VILLANOVA;Madrid
241500;Avenida del Doctor Federico Rubio y GalÝ;1479;1471;1988;CICLOCALLES;1;0; AVENIDA DEL DOCTOR FEDERICO RUBIO Y GALÍ;DOCTOR FEDERICO RUBIO Y GALI;36,36021887870;Avenida;DOCTOR FEDERICO RUBIO GALÍ;Madrid
523300;Calle del Camino de la Moreras;1480;1472;1989;CICLOCALLES;1;0; CALLE DEL CAMINO DE LA MORERAS;MORERAS;309,49521305200;Calle;MORERAS;Madrid
238800;Paseo de la Direcci¾n;1481;1473;1990;CICLOCALLES;1;0; PASEO DE LA DIRECCIÓN;DIRECCION;345,95625291600;Paseo;DIRECCIÓN;Madrid
442100;Calle de Lorenzana;1482;1474;1991;CICLOCALLES;1;0; CALLE DE LORENZANA;LORENZANA;138,46200420600;Calle;LORENZANA;Madrid
684250;Calle de San Restituto;1483;1475;1992;CICLOCALLES;0;1; CALLE DE SAN RESTITUTO;SAN RESTITUTO;261,21351615600;Calle;SAN RESTITUTO;Madrid
723600;Calle de Sinesio Delgado;1484;1476;1993;PEATONAL;0;0; CALLE DE SINESIO DELGADO;SINESIO DELGADO;115,65736500200;Calle;SINESIO DELGADO;Madrid
764775;Calle de Valdeverdeja;1485;1477;1994;CICLOCALLES;0;1; CALLE DE VALDEVERDEJA;VALDEVERDEJA;119,92378166300;Calle;VALDEVERDEJA;Madrid
1933;Calle de CÚsar Manrique;1486;1478;1995;CICLOCALLES;0;1; CALLE DE CÚSAR MANRIQUE;CESAR MANRIQUE;154,36482006900;Calle;CÚSAR MANRIQUE;Madrid
59475;Calle de Antonio Machado;1487;1479;1996;CICLOCALLES;0;1; CALLE DE ANTONIO MACHADO;ANTONIO MACHADO;168,72357837500;Calle;ANTONIO MACHADO;Madrid
764550;Calle de Valderrodrigo;1488;1480;1997;CICLOCALLES;0;1; CALLE DE VALDERRODRIGO;VALDERRODRIGO;71,07857234320;Calle;VALDERRODRIGO;Madrid
764650;Calle de ValdevarnÚs;1489;1481;1998;CICLOCALLES;0;1; CALLE DE VALDEVARNÚS;VALDEVARNES;238,34675626600;Calle;VALDEVARNÚS;Madrid
764585;Calle de Valdesangil;1490;1482;1999;CICLOCALLES;0;1; CALLE DE VALDESANGIL;VALDESANGIL;110,74217952800;Calle;VALDESANGIL;Madrid
1852;Calle de Gascones;1491;1483;2000;CICLOCALLES;0;1; CALLE DE GASCONES;GASCONES;97,84997980290;Calle;GASCONES;Madrid
39600;Calle de Amadeo G¾mez;1492;1484;2001;CICLOCALLES;-1;0; CALLE DE AMADEO GÓMEZ;AMADEO GOMEZ;138,83860571600;Calle;AMADEO GÓMEZ;Madrid
373700;Calle de la Senda del Infante;1493;1485;2002;CICLOCALLES;0;1; CALLE DE LA SENDA DEL INFANTE;SENDA DEL INFANTE;296,94784550000;Calle;INFANTE;Madrid
521800;Calle de Moralzarzal;1494;1486;2003;CICLOCALLES;0;1; CALLE DE MORALZARZAL;MORALZARZAL;300,81060022200;Calle;MORALZARZAL;Madrid
31000138;Calle de Monasterio de El Paular;1495;1487;2004;CICLOCALLES;0;1; CALLE DE MONASTERIO DE EL PAULAR;MONASTERIO DE EL PAULAR;535,05390318400;Calle;MONASTERIO PAULAR;Madrid
28050;Calle de Alfredo Marquerie;1496;1488;2005;CICLOCALLES;0;1; CALLE DE ALFREDO MARQUERIE;ALFREDO MARQUERIE;447,45048431900;Calle;ALFREDO MARQUERIE;Madrid
521800;Calle de Moralzarzal;1497;1489;2006;CICLOCALLES;0;1; CALLE DE MORALZARZAL;MORALZARZAL;363,99815275300;Calle;MORALZARZAL;Madrid
580600;Calle de Pe±a Sirio;1498;1490;2007;CICLOCALLES;0;1; CALLE DE PEÑA SIRIO;PEÐA SIRIO;184,74628953600;Calle;PEÑA SIRIO;Madrid
437225;Calle de Lezama;1499;1491;2008;CICLOCALLES;1;0; CALLE DE LEZAMA;LEZAMA;288,51456983100;Calle;LEZAMA;Madrid
427150;Calle de Labastida;1500;1492;2009;CICLOCALLES;0;1; CALLE DE LABASTIDA;LABASTIDA;161,74057693600;Calle;LABASTIDA;Madrid
829;Calle de Antoniorrobles;1501;1493;2010;CICLOCALLES;1;0; CALLE DE ANTONIORROBLES;ANTONIORROBLES;58,99952886480;Calle;ANTONIORROBLES;Madrid
450675;Calle de Llodio;1502;1494;2011;CICLOCALLES;-1;0; CALLE DE LLODIO;LLODIO;65,94050031110;Calle;LLODIO;Madrid
657775;Calle de Salvatierra;1503;1495;2012;CICLOCALLES;-1;0; CALLE DE SALVATIERRA;SALVATIERRA;284,26684469300;Calle;SALVATIERRA;Madrid
724;Calle de La Estrada;1504;1496;2013;CICLOCALLES;-1;0; CALLE DE LA ESTRADA;LA ESTRADA;192,73438175900;Calle;ESTRADA;Madrid
543100;Calle de Nuria;1505;1497;2014;PEATONAL;0;0; CALLE DE NURIA;NURIA;56,45487774010;Calle;NURIA;Madrid
471100;Calle de Marbella;1506;1498;2015;CICLOCALLES;0;1; CALLE DE MARBELLA;MARBELLA;415,93539320800;Calle;MARBELLA;Madrid
493300;Calle de La Maso;1507;1499;2016;CICLOCALLES;0;1; CALLE DE LA MASO;LA MASO;259,87658619700;Calle;MASO;Madrid
493300;Calle de La Maso;1508;1500;2017;CICLOCALLES;0;1; CALLE DE LA MASO;LA MASO;468,90401612400;Calle;MASO;Madrid
493300;Calle de La Maso;1509;1501;2018;CICLOCALLES;0;1; CALLE DE LA MASO;LA MASO;60,12362042500;Calle;MASO;Madrid
216900;Calle de la Costa Brava;1510;1502;2020;CICLOCALLES;0;1; CALLE DE LA COSTA BRAVA;COSTA BRAVA;245,08671510600;Calle;COSTA BRAVA;Madrid
291650;Calle de FermÝn Caballero;1512;1504;2022;CICLOCALLES;0;1; CALLE DE FERMÍN CABALLERO;FERMIN CABALLERO;70,62440930400;Calle;FERMÍN CABALLERO;Madrid
379875;Calle de la Isla de Arosa;1513;1505;2023;CICLOCALLES;0;1; CALLE DE LA ISLA DE AROSA;ISLA DE AROSA;97,35161114700;Calle;ISLA AROSA;Madrid
291650;Calle de FermÝn Caballero;1514;1506;2024;CICLOCALLES;0;1; CALLE DE FERMÍN CABALLERO;FERMIN CABALLERO;152,53487587800;Calle;FERMÍN CABALLERO;Madrid
106100;Avenida de Betanzos;1515;1507;2025;CICLOCALLES;-1;0; AVENIDA DE BETANZOS;BATANZOS;141,69766524700;Avenida;BETANZOS;Madrid
313100;Calle de Fuencarral;469;425;427;CICLOCALLES;1;0; CALLE DE FUENCARRAL;FUENCARRAL;561,56360064100;Calle;FUENCARRAL;Madrid
18800;Calle de Alburquerque;470;426;428;CICLOCALLES;-1;0; CALLE DE ALBURQUERQUE;ALBURQUERQUE;312,23044507700;Calle;ALBURQUERQUE;Madrid
-1;;471;427;429;PEATONAL;0;0;;;297,76977057300;;;Madrid
341000;Calle de Gonzalo de C¾rdoba;472;428;431;CICLOCALLES;-1;0; CALLE DE GONZALO DE CÓRDOBA;GONZALO DE CORDOBA;190,91435206400;Calle;GONZALO CÓRDOBA;Madrid
94000;Calle de Barquillo;474;430;442;CICLOCALLES;1;0; CALLE DE BARQUILLO;BARQUILLO;601,90009521600;Calle;BARQUILLO;Madrid
99100;Calle de BelÚn;475;431;443;CICLOCALLES;1;0; CALLE DE BELÚN;BELEN;144,27470295100;Calle;BELÚN;Madrid
72985;Calle del Arquitecto L¾pez Otero;476;432;444;CICLOCALLES;1;0; CALLE DEL ARQUITECTO LÓPEZ OTERO;ARQUITECTO LOPEZ OTERO;939,11392471100;Calle;ARQUITECTO LÓPEZ OTERO;Madrid
489650;Calle de MartÝn Fierro;477;433;444;CICLOCALLES;1;0; CALLE DE MARTÍN FIERRO;MARTIN FIERRO;243,90609383900;Calle;MARTÍN FIERRO;Madrid
39900;Calle de Amado Nervo;481;436;451;CICLOCALLES;-1;0; CALLE DE AMADO NERVO;AMADO NERVO;300,65129318500;Calle;AMADO NERVO;Madrid
158900;Calle de Cavanilles;482;437;452;CICLOCALLES;0;1; CALLE DE CAVANILLES;CAVANILLES;114,49021254300;Calle;CAVANILLES;Madrid
310600;Calle de Francisco Vitoria;483;438;453;CICLOCALLES;-1;0; CALLE DE FRANCISCO VITORIA;FRANCISCO VITORIA;111,67000984900;Calle;FRANCISCO VITORIA;Madrid
419000;Calle de Juan de Urbieta;484;439;454;CICLOCALLES;-1;0; CALLE DE JUAN DE URBIETA;JUAN DE URBIETA;309,96618896600;Calle;JUAN URBIETA;Madrid
1816;Calle de Antonio DÝaz-Ca±abate;485;440;455;PEATONAL;0;0; CALLE DE ANTONIO DÍAZ-CA±ABATE;ANTONIO DIAZ-CAÐABATE;111,32822244700;Calle;ANTONIO DÍAZ-CA±ABATE;Madrid
596850;Calle de PÝo Baroja;486;441;456;CICLOCALLES;0;1; CALLE DE PÍO BAROJA;PIO BAROJA;421,72595203800;Calle;PÍO BAROJA;Madrid
239500;Calle del Doce de Octubre;488;443;460;CICLOCALLES;1;0; CALLE DEL DOCE DE OCTUBRE;DOCE DE OCTUBRE;132,57110772300;Calle;DOCE OCTUBRE;Madrid
242550;Plaza del Doctor Laguna;489;444;464;PEATONAL;0;0; PLAZA DEL DOCTOR LAGUNA;DOCTOR LAGUNA;50,52422835090;Plaza;DOCTOR LAGUNA;Madrid
596850;Calle de PÝo Baroja;490;445;465;CICLOCALLES;0;1; CALLE DE PÍO BAROJA;PIO BAROJA;96,08173085050;Calle;PÍO BAROJA;Madrid
456900;Calle de Maldonado;491;446;468;CICLOCALLES;-1;0; CALLE DE MALDONADO;MALDONADO;738,74878000900;Calle;MALDONADO;Madrid
9500;Calle de Aguirre;492;447;469;CICLOCALLES;1;0; CALLE DE AGUIRRE;AGUIRRE;87,68964250850;Calle;AGUIRRE;Madrid
172600;Calle de Claudio Coello;493;448;470;CICLOCALLES;1;0; CALLE DE CLAUDIO COELLO;CLAUDIO COELLO;1035,13810377000;Calle;CLAUDIO COELLO;Madrid
18900;Calle de Alcalß;494;449;480;PEATONAL;0;0; CALLE DE ALCALÁ;ALCALA;131,67510816000;Calle;ALCALÁ;Madrid
267400;Calle de Enrique Larreta;498;453;500;CICLOCALLES;1;0; CALLE DE ENRIQUE LARRETA;ENRIQUE LARRETA;243,60838340700;Calle;ENRIQUE LARRETA;Madrid
353200;Paseo de la Habana;499;454;501;CICLOCALLES;1;0; PASEO DE LA HABANA;HABANA;60,33244419830;Paseo;HABANA;Madrid
267400;Calle de Enrique Larreta;500;455;502;CICLOCALLES;1;0; CALLE DE ENRIQUE LARRETA;ENRIQUE LARRETA;238,92248125400;Calle;ENRIQUE LARRETA;Madrid
-1;Parque de RodrÝguez Sahag·n;503;458;503;PEATONAL;0;0; PARQUE DE RODRÍGUEZ SAHAGÚN;RODRIGUEZ SAHAGUN;79,60129978800;;PARQUE RODRÍGUEZ SAHAGÚN;Madrid
-1;Parque de RodrÝguez Sahag·n;504;459;504;PEATONAL;0;0; PARQUE DE RODRÍGUEZ SAHAGÚN;RODRIGUEZ SAHAGUN;357,10104204000;;PARQUE RODRÍGUEZ SAHAGÚN;Madrid
597200;Avenida de PÝo XII;505;460;505;CICLOCALLES;1;0; AVENIDA DE PÍO XII;PIO XII;470,97541484700;Avenida;PÍO XII;Madrid
318500;Calle de Fulgencio de Miguel;506;461;506;CICLOCALLES;1;0; CALLE DE FULGENCIO DE MIGUEL;FULGENCIO DE MIGUEL;61,68511491010;Calle;FULGENCIO MIGUEL;Madrid
464800;Calle de Manuel Luna;507;462;506;CICLOCALLES;1;0; CALLE DE MANUEL LUNA;MANUEL LUNA;318,97900808400;Calle;MANUEL LUNA;Madrid
298100;Calle de Florencio GarcÝa;1600;1591;1206;CICLOCALLES;0;1; CALLE DE FLORENCIO GARCÍA;FLORENCIO GARCIA;133,07433240600;Calle;FLORENCIO GARCÍA;Madrid
250500;Calle de Doroteo Benache;508;463;507;CICLOCALLES;0;1; CALLE DE DOROTEO BENACHE;DOROTEO BENACHE;158,92779005000;Calle;DOROTEO BENACHE;Madrid
762005;Avenida de la Ilustraci¾n;509;464;508;PEATONAL;0;0; AVENIDA DE LA ILUSTRACIÓN;ILUSTRACION;395,93472313800;Avenida;ILUSTRACIÓN;Madrid
471300;Calle de Marcelina;510;465;510;CICLOCALLES;1;0; CALLE DE MARCELINA;MARCELINA;362,18134225000;Calle;MARCELINA;Madrid
512600;Calle de Molina;511;466;510;CICLOCALLES;1;0; CALLE DE MOLINA;MOLINA;437,24007334800;Calle;MOLINA;Madrid
